{
  "schemaVersion": 1,
  "contract": "quant-research-summary",
  "projectId": "kelly",
  "title": "Kelly Allocation Lab",
  "state": "degraded",
  "generatedAt": "2026-07-22T00:17:42.961790+00:00",
  "dataAsOf": "2026-07-21",
  "status": {
    "state": "degraded",
    "label": "검증된 연구 데이터 공개",
    "message": "출처와 수익률 기준을 검증한 일별 시계열 48/50개를 제공합니다."
  },
  "coverage": {
    "assetCount": 50,
    "availableAssetCount": 48,
    "frequency": "daily"
  },
  "primaryEntities": [
    {
      "id": "kelly-allocation-lab",
      "name": "Kelly Allocation Lab",
      "kind": "research",
      "state": "degraded",
      "headlineMetrics": [
        {
          "id": "full-kelly",
          "label": "풀 켈리 비중",
          "value": null,
          "unit": "fraction",
          "state": "unavailable"
        },
        {
          "id": "expected-log-growth",
          "label": "기대 연 로그성장률",
          "value": null,
          "unit": "percent",
          "state": "unavailable"
        }
      ],
      "detailUrl": "./"
    }
  ],
  "limitations": [
    "정적 요약에는 검증된 시장 관측값이 아직 포함되지 않았습니다.",
    "계산기는 사용자가 직접 입력한 가정과 실데이터 결과를 명확히 구분해야 합니다."
  ]
}
